Time,Title,Rate Limit Remaining,Title_Clean,Sentiment,Sentiment_Score,Topic,Topic_Score,Cluster
Wed Apr  2 21:10:25 2025,The threat of US–centric social media,999.0,the threat of uscentric social media,NEGATIVE,0.4977364838123321,security,0.5371630787849426,1
Wed Apr  2 21:10:30 2025,Artificial Intelligence: A Deadly Love Affair with a Chatbot,999.0,artificial intelligence a deadly love affair with a chatbot,NEUTRAL,0.5337092876434326,AI,0.7177416682243347,2
Wed Apr  2 21:10:35 2025,"NaNoWriMo shut down after AI, content moderation scandals",999.0,nanowrimo shut down after ai content moderation scandals,NEGATIVE,0.640799880027771,AI,0.7041357159614563,4
Wed Apr  2 21:10:40 2025,"With Section 230 Repeal, Dems and Media Offer Trump New Censorship Tools",999.0,with section 230 repeal dems and media offer trump new censorship tools,NEUTRAL,0.585205614566803,gadgets,0.3157692551612854,1
Wed Apr  2 21:10:45 2025,I tried the VR headset that puts domestic abusers in victims’ shoes,999.0,i tried the vr headset that puts domestic abusers in victims shoes,NEGATIVE,0.626401424407959,hardware,0.703480064868927,0
Wed Apr  2 21:10:50 2025,"Starliner’s flight to the space station was far wilder than most of us thought | ""Hey, this is a very precarious situation we're in.""",999.0,starliners flight to the space station was far wilder than most of us thought  hey this is a very precarious situation were in.,NEUTRAL,0.4596792161464691,hardware,0.3292573690414428,0
Wed Apr  2 21:10:55 2025,How Meta’s Upcoming $1000+ Smart Glasses with a Screen Will Work,999.0,how metas upcoming $1000 smart glasses with a screen will work,NEUTRAL,0.6786783933639526,gadgets,0.5152955055236816,1
Wed Apr  2 21:11:00 2025,4chan’s DOGE-inspired April Fools’ prank leaves posters seething,999.0,4chans dogeinspired april fools prank leaves posters seething,NEUTRAL,0.615460991859436,gadgets,0.3295599222183227,2
Wed Apr  2 21:11:05 2025,"Meta loses its AI research head, as billions in investments hang in the balance",999.0,meta loses its ai research head as billions in investments hang in the balance,NEGATIVE,0.5375699996948242,AI,0.8954325914382935,3
Wed Apr  2 21:11:10 2025,Viral Studio Ghibli-style AI images showcase power – and copyright concerns – of ChatGPT update,999.0,viral studio ghiblistyle ai images showcase power  and copyright concerns  of chatgpt update,NEUTRAL,0.7102393507957458,AI,0.5383227467536926,1
Wed Apr  2 21:11:15 2025,Cheap TVs’ incessant advertising reaches troubling new lows,999.0,cheap tvs incessant advertising reaches troubling new lows,NEGATIVE,0.9280730485916138,gadgets,0.4938841462135315,2
Wed Apr  2 21:11:20 2025,"Waltz and staff used Gmail for government communications, officials say",999.0,waltz and staff used gmail for government communications officials say,NEUTRAL,0.8078099489212036,software,0.6218803524971008,1
Wed Apr  2 21:11:25 2025,"BYD Announces Home Solar-Powered Humanoid Robot for $10,000",999.0,byd announces home solarpowered humanoid robot for $10000,NEUTRAL,0.7645780444145203,hardware,0.5180952548980713,3
Wed Apr  2 21:11:30 2025,"""Cross-post: I’m a former CIA officer, National Security Council staffer, and diplomat – AMA about Signalgate""",999.0,crosspost im a former cia officer national security council staffer and diplomat  ama about signalgate,NEUTRAL,0.8575809597969055,security,0.9127793908119202,2
Wed Apr  2 21:11:35 2025,Intel announces 18A process node has entered risk production — crucial milestone comes as company ramps to Panther Lake chips,999.0,intel announces 18a process node has entered risk production  crucial milestone comes as company ramps to panther lake chips,POSITIVE,0.5115513205528259,security,0.5527588725090027,3
Wed Apr  2 21:11:40 2025,Brain waves become spoken words in AI breakthrough for paralysis,999.0,brain waves become spoken words in ai breakthrough for paralysis,NEUTRAL,0.790837824344635,AI,0.967862904071808,3
Wed Apr  2 21:11:45 2025,"One of Australia’s oldest wind farms turns 20 today, and will live on for another decade",999.0,one of australias oldest wind farms turns 20 today and will live on for another decade,POSITIVE,0.6939939260482788,security,0.3538978695869446,1
Wed Apr  2 21:11:50 2025,"""Tech’s big anxiety: fewer jobs, lower pay, more AI""",999.0,techs big anxiety fewer jobs lower pay more ai,NEGATIVE,0.6882169246673584,AI,0.3727178573608398,2
Wed Apr  2 21:11:55 2025,"""Crosspost: I’m a former CIA officer, National Security Council staffer, and diplomat – AMA about Signalgate""",999.0,crosspost im a former cia officer national security council staffer and diplomat  ama about signalgate,NEUTRAL,0.8575809597969055,security,0.9127793908119202,2
Wed Apr  2 21:12:00 2025,Former Sony Exec Says It's About Time For PlayStation to Reconsider Its Focus on Cutting-Edge Graphics,999.0,former sony exec says its about time for playstation to reconsider its focus on cuttingedge graphics,NEUTRAL,0.78330397605896,hardware,0.4076648950576782,3
Wed Apr  2 21:12:05 2025,"ZeniMax workers union votes to authorize a strike against Microsoft over stalled contract negotiations | After nearly two years of negotiations, a contract agreement still hasn't been reached.",999.0,zenimax workers union votes to authorize a strike against microsoft over stalled contract negotiations  after nearly two years of negotiations a contract agreement still hasnt been reached.,NEGATIVE,0.6530479192733765,software,0.6770579218864441,4
Wed Apr  2 21:12:10 2025,Nikola founder says nearly $2 million in political donations he and his wife gave to President Donald Trump had nothing to do with his pardon,999.0,nikola founder says nearly $2 million in political donations he and his wife gave to president donald trump had nothing to do with his pardon,NEUTRAL,0.7188839316368103,software,0.5521555542945862,1
Wed Apr  2 21:12:15 2025,Japan's Rapidus gears up for test production of next-generation chips,999.0,japans rapidus gears up for test production of nextgeneration chips,NEUTRAL,0.9056629538536072,hardware,0.6512426733970642,1
Wed Apr  2 21:12:20 2025,Nintendo has moved beyond specs | The company is as popular as it has ever been — and it owes it to leaving the technological arms race behind,999.0,nintendo has moved beyond specs  the company is as popular as it has ever been  and it owes it to leaving the technological arms race behind,POSITIVE,0.892217755317688,security,0.2531197369098663,1
Wed Apr  2 21:12:25 2025,Trump Sets Up New Office To Manage CHIPS Act And Speed Up Investments,999.0,trump sets up new office to manage chips act and speed up investments,NEUTRAL,0.8475819230079651,gadgets,0.4456136524677276,1
Wed Apr  2 21:12:30 2025,Police told not to close investigations until they have used facial recognition,999.0,police told not to close investigations until they have used facial recognition,NEUTRAL,0.6199040412902832,security,0.6895129084587097,3
Wed Apr  2 21:12:35 2025,Lightmatter says it's ready to ship chip-to-chip optical highways as early as summer,999.0,lightmatter says its ready to ship chiptochip optical highways as early as summer,NEUTRAL,0.8559088706970215,hardware,0.3170660138130188,3
Wed Apr  2 21:12:40 2025,SpaceX Shares Stunning Polar Views From Its Historic Fram2 Mission,999.0,spacex shares stunning polar views from its historic fram2 mission,POSITIVE,0.9157482385635376,hardware,0.6034005880355835,3
Wed Apr  2 21:12:45 2025,"Andreessen Horowitz is trying to nab a piece of TikTok with Oracle, report says",999.0,andreessen horowitz is trying to nab a piece of tiktok with oracle report says,NEUTRAL,0.8971361517906189,AI,0.328321099281311,1
Wed Apr  2 21:12:50 2025,Arm aims to capture 50% of data center CPU market in 2025,999.0,arm aims to capture 50 of data center cpu market in 2025,NEUTRAL,0.7440811395645142,hardware,0.6568851470947266,1
Wed Apr  2 21:12:55 2025,How crawlers impact the operations of the Wikimedia projects,999.0,how crawlers impact the operations of the wikimedia projects,NEUTRAL,0.8493599891662598,gadgets,0.638512134552002,1
Wed Apr  2 21:13:00 2025,EuroStack – A European Alternative for Digital Sovereignty,999.0,eurostack  a european alternative for digital sovereignty,NEUTRAL,0.8238368034362793,security,0.4097890257835388,3
Wed Apr  2 21:13:05 2025,"Andy Yen: ""The proposed Swiss surveillance law would be stricter than in the US. We will leave Switzerland if it enters into force.""",999.0,andy yen the proposed swiss surveillance law would be stricter than in the us. we will leave switzerland if it enters into force.,NEUTRAL,0.58258455991745,security,0.3815921247005462,0
Wed Apr  2 21:40:36 2025,"In breakthrough, Israeli-led team activates dormant bone marrow cells for transplants",999.0,in breakthrough israeliled team activates dormant bone marrow cells for transplants,NEUTRAL,0.6344573497772217,security,0.258360356092453,3
Wed Apr  2 21:40:41 2025,VMware Workstation auto-updates broken after Broadcom URL redirect,999.0,vmware workstation autoupdates broken after broadcom url redirect,NEGATIVE,0.7424581050872803,hardware,0.5558612942695618,4
Wed Apr  2 21:40:46 2025,"Making the Case to Students That Math Is Important, Even When AI Does It All",999.0,making the case to students that math is important even when ai does it all,NEUTRAL,0.5641770958900452,AI,0.9621464610099792,1
Wed Apr  2 21:40:51 2025,Micron confirms memory price hikes as AI and data center demand surges,999.0,micron confirms memory price hikes as ai and data center demand surges,NEUTRAL,0.8289231657981873,AI,0.9209988117218018,1
Wed Apr  2 21:40:56 2025,A Startup Linked to Peter Thiel Wants to Build the “Next Great City” in Greenland,999.0,a startup linked to peter thiel wants to build the next great city in greenland,POSITIVE,0.9252330660820008,AI,0.263195276260376,0
Wed Apr  2 21:41:01 2025,"College students are using AI, but they're conflicted about it",999.0,college students are using ai but theyre conflicted about it,NEUTRAL,0.6113959550857544,AI,0.792982280254364,3
Wed Apr  2 21:41:06 2025,"US attorney general announces federal charges, Texas arrest of Tesla crime suspect. Justice Department will be seeking 20 years in prison",999.0,us attorney general announces federal charges texas arrest of tesla crime suspect. justice department will be seeking 20 years in prison,NEUTRAL,0.6670054197311401,AI,0.5483376383781433,0
Wed Apr  2 21:41:11 2025,Anthropic will begin sweeping offices for hidden devices as it ramps up security,999.0,anthropic will begin sweeping offices for hidden devices as it ramps up security,NEUTRAL,0.8435149788856506,security,0.929429531097412,1
Wed Apr  2 21:41:16 2025,OpenAI plans to release a new 'open' AI language model in the coming months | TechCrunch,999.0,openai plans to release a new open ai language model in the coming months  techcrunch,NEUTRAL,0.7337816953659058,AI,0.7795343399047852,1
Wed Apr  2 21:41:21 2025,Ford Patents A Manual Gear Shifter For EVs,999.0,ford patents a manual gear shifter for evs,NEUTRAL,0.9165555834770204,hardware,0.7980217337608337,3
Wed Apr  2 21:41:26 2025,JPMorgan Just Beat Big Tech to a Quantum Breakthrough,999.0,jpmorgan just beat big tech to a quantum breakthrough,POSITIVE,0.6332579255104065,gadgets,0.3552064299583435,4
Wed Apr  2 21:41:31 2025,"""Oracle buried serious data breach from customers, now hacker has it up for sale | Company remains quiet since denying the attack, even after researchers conclude the breach is real""",999.0,oracle buried serious data breach from customers now hacker has it up for sale  company remains quiet since denying the attack even after researchers conclude the breach is real,NEGATIVE,0.6874624490737915,security,0.7201960682868958,1
Wed Apr  2 21:41:36 2025,X hit by 2.8 billion profile data leak in alleged insider job,999.0,x hit by 2.8 billion profile data leak in alleged insider job,NEGATIVE,0.5677831172943115,security,0.7155542969703674,0
Wed Apr  2 21:41:41 2025,Tesla car sales in France drop to lowest first-quarter in four years,999.0,tesla car sales in france drop to lowest firstquarter in four years,NEGATIVE,0.7005565166473389,AI,0.3496245741844177,0
Wed Apr  2 21:41:46 2025,Why global tensions are a cybersecurity problem for every business,999.0,why global tensions are a cybersecurity problem for every business,NEGATIVE,0.692206621170044,security,0.9899610877037048,3
Wed Apr  2 21:41:51 2025,Asda's tech separation from Walmart nears £1B as delays mount,999.0,asdas tech separation from walmart nears 1b as delays mount,NEGATIVE,0.5137373805046082,security,0.3272484242916107,4
Wed Apr  2 21:41:56 2025,"""Men’s turn: US scientists unveil a hormone-free male birth control pill! | YCT-529, a hormone-free pill developed by US researchers, has shown 99% effectiveness in trials and is now in human testing.""",999.0,mens turn us scientists unveil a hormonefree male birth control pill  yct529 a hormonefree pill developed by us researchers has shown 99 effectiveness in trials and is now in human testing.,POSITIVE,0.6618654727935791,security,0.4010213911533355,4
Wed Apr  2 21:42:01 2025,Coin-sized nuclear 3V battery with 50-year lifespan enters mass production | The company plans to launch a more powerful single-watt version this year,999.0,coinsized nuclear 3v battery with 50year lifespan enters mass production  the company plans to launch a more powerful singlewatt version this year,POSITIVE,0.5610755681991577,hardware,0.7219612002372742,0
Wed Apr  2 21:42:06 2025,EV chargers now outnumber gas pumps in California as zero-emission vehicles surge | The state accounts for 30 percent of all new zero-emission vehicle sales nationwide,999.0,ev chargers now outnumber gas pumps in california as zeroemission vehicles surge  the state accounts for 30 percent of all new zeroemission vehicle sales nationwide,NEUTRAL,0.6136914491653442,gadgets,0.6729891896247864,1
Wed Apr  2 21:42:11 2025,NASA astronauts open up about being 'stuck' in space for 9 months,999.0,nasa astronauts open up about being stuck in space for 9 months,NEUTRAL,0.5920414328575134,gadgets,0.273010104894638,1
Wed Apr  2 21:42:16 2025,A stroke survivor speaks again with the help of an experimental brain-computer implant,999.0,a stroke survivor speaks again with the help of an experimental braincomputer implant,NEUTRAL,0.7241031527519226,software,0.2927316427230835,1
Wed Apr  2 21:42:21 2025,"New Microsoft login screens emphasize passkeys and ""passwordless"" authentication",999.0,new microsoft login screens emphasize passkeys and passwordless authentication,NEUTRAL,0.8526829481124878,security,0.5878190994262695,1
Wed Apr  2 21:42:26 2025,OpenAI's new image generator is now available to all users | TechCrunch,999.0,openais new image generator is now available to all users  techcrunch,POSITIVE,0.7626169323921204,software,0.8114103078842163,1
Wed Apr  2 21:42:31 2025,Woman's Brain Implant Turns Her Thoughts Into Speech in Real Time,999.0,womans brain implant turns her thoughts into speech in real time,NEUTRAL,0.8544186353683472,hardware,0.4499541223049164,0
Wed Apr  2 21:42:36 2025,OnlyFans Sued After Two Guys Realized They Might Not Actually Be Talking to Models | A class action complaint claims OnlyFans is allowing fraud on its platform by letting models use agency chat service to talk to fans,999.0,onlyfans sued after two guys realized they might not actually be talking to models  a class action complaint claims onlyfans is allowing fraud on its platform by letting models use agency chat service to talk to fans,NEGATIVE,0.821153461933136,security,0.4689444303512573,3
Wed Apr  2 21:42:41 2025,Crowdsourced DNA Project Says It Will Shut Down to Protect Users from Rising Authoritarianism | The creator said he is worried about the changing political climate circling the globe.,999.0,crowdsourced dna project says it will shut down to protect users from rising authoritarianism  the creator said he is worried about the changing political climate circling the globe.,NEUTRAL,0.5089030265808105,security,0.6763957142829895,0
Wed Apr  2 21:42:46 2025,"World champs of white supremacy — why SA needs online disinformation laws, quick",999.0,world champs of white supremacy  why sa needs online disinformation laws quick,NEGATIVE,0.6091863512992859,security,0.544447660446167,1
Wed Apr  2 21:42:51 2025,"""Texas Lawmakers Just Can’t Quit Solar … Manufacturing, That Is | Tariffs or not, Texas is rapidly becoming an epicenter of domestic solar manufacturing in the US, with an assist from overseas investors.""",999.0,texas lawmakers just cant quit solar  manufacturing that is  tariffs or not texas is rapidly becoming an epicenter of domestic solar manufacturing in the us with an assist from overseas investors.,NEUTRAL,0.4811064600944519,security,0.3499928116798401,1
Wed Apr  2 21:42:56 2025,Papers and patents are becoming less disruptive over time,999.0,papers and patents are becoming less disruptive over time,NEUTRAL,0.5885993838310242,security,0.5412471294403076,3
Wed Apr  2 21:43:01 2025,Apple backports zero-day patches to older iPhones and Macs,999.0,apple backports zeroday patches to older iphones and macs,NEUTRAL,0.7228959798812866,software,0.56195068359375,1
Wed Apr  2 21:43:06 2025,Vacheron Constantin Has Made the World’s Most Complicated Wristwatch,999.0,vacheron constantin has made the worlds most complicated wristwatch,POSITIVE,0.9167103171348572,hardware,0.6107245087623596,0
Wed Apr  2 21:43:11 2025,Scientists merge two 'impossible' materials into new artificial structure,999.0,scientists merge two impossible materials into new artificial structure,NEUTRAL,0.6762920022010803,AI,0.5721952319145203,0
Wed Apr  2 21:43:16 2025,"We are finally beginning to understand how LLMs work: No, they don't simply predict word after word",999.0,we are finally beginning to understand how llms work no they dont simply predict word after word,NEUTRAL,0.5871615409851074,software,0.5770592093467712,4
Wed Apr  2 21:43:22 2025,Mercedes Weighs Pulling US Entry-Level Cars Over Tariffs,999.0,mercedes weighs pulling us entrylevel cars over tariffs,NEUTRAL,0.6019988059997559,hardware,0.7016471028327942,4
Wed Apr  2 21:43:27 2025,Japan enforces law for swift removal of defamatory online posts,999.0,japan enforces law for swift removal of defamatory online posts,NEUTRAL,0.766144335269928,security,0.4683437645435333,0
Wed Apr  2 21:43:32 2025,Charging electric vehicles 5x faster in subfreezing temps,999.0,charging electric vehicles 5x faster in subfreezing temps,POSITIVE,0.7611103057861328,gadgets,0.5300858020782471,0
Wed Apr  2 21:43:37 2025,The threat of US–centric social media,999.0,the threat of uscentric social media,NEGATIVE,0.4977364838123321,security,0.5371630787849426,1
Wed Apr  2 21:43:42 2025,Artificial Intelligence: A Deadly Love Affair with a Chatbot,999.0,artificial intelligence a deadly love affair with a chatbot,NEUTRAL,0.5337092876434326,AI,0.7177416682243347,2
Wed Apr  2 21:43:47 2025,"NaNoWriMo shut down after AI, content moderation scandals",999.0,nanowrimo shut down after ai content moderation scandals,NEGATIVE,0.640799880027771,AI,0.7041357159614563,4
Wed Apr  2 21:43:52 2025,"With Section 230 Repeal, Dems and Media Offer Trump New Censorship Tools",999.0,with section 230 repeal dems and media offer trump new censorship tools,NEUTRAL,0.585205614566803,gadgets,0.3157692551612854,1
Wed Apr  2 21:43:57 2025,I tried the VR headset that puts domestic abusers in victims’ shoes,999.0,i tried the vr headset that puts domestic abusers in victims shoes,NEGATIVE,0.626401424407959,hardware,0.703480064868927,0
Wed Apr  2 21:44:02 2025,"Starliner’s flight to the space station was far wilder than most of us thought | ""Hey, this is a very precarious situation we're in.""",999.0,starliners flight to the space station was far wilder than most of us thought  hey this is a very precarious situation were in.,NEUTRAL,0.4596792161464691,hardware,0.3292573690414428,0
Wed Apr  2 21:44:07 2025,How Meta’s Upcoming $1000+ Smart Glasses with a Screen Will Work,999.0,how metas upcoming $1000 smart glasses with a screen will work,NEUTRAL,0.6786783933639526,gadgets,0.5152955055236816,1
Wed Apr  2 21:44:12 2025,4chan’s DOGE-inspired April Fools’ prank leaves posters seething,999.0,4chans dogeinspired april fools prank leaves posters seething,NEUTRAL,0.615460991859436,gadgets,0.3295599222183227,2
Wed Apr  2 21:44:17 2025,"Meta loses its AI research head, as billions in investments hang in the balance",999.0,meta loses its ai research head as billions in investments hang in the balance,NEGATIVE,0.5375699996948242,AI,0.8954325914382935,3
Wed Apr  2 21:44:22 2025,Viral Studio Ghibli-style AI images showcase power – and copyright concerns – of ChatGPT update,999.0,viral studio ghiblistyle ai images showcase power  and copyright concerns  of chatgpt update,NEUTRAL,0.7102393507957458,AI,0.5383227467536926,1
Wed Apr  2 21:44:27 2025,Cheap TVs’ incessant advertising reaches troubling new lows,999.0,cheap tvs incessant advertising reaches troubling new lows,NEGATIVE,0.9280730485916138,gadgets,0.4938841462135315,2
Wed Apr  2 21:44:32 2025,"Waltz and staff used Gmail for government communications, officials say",999.0,waltz and staff used gmail for government communications officials say,NEUTRAL,0.8078099489212036,software,0.6218803524971008,1
Wed Apr  2 21:44:37 2025,"BYD Announces Home Solar-Powered Humanoid Robot for $10,000",999.0,byd announces home solarpowered humanoid robot for $10000,NEUTRAL,0.7645780444145203,hardware,0.5180952548980713,3
Wed Apr  2 21:44:42 2025,"""Cross-post: I’m a former CIA officer, National Security Council staffer, and diplomat – AMA about Signalgate""",999.0,crosspost im a former cia officer national security council staffer and diplomat  ama about signalgate,NEUTRAL,0.8575809597969055,security,0.9127793908119202,2
Wed Apr  2 21:44:47 2025,Intel announces 18A process node has entered risk production — crucial milestone comes as company ramps to Panther Lake chips,999.0,intel announces 18a process node has entered risk production  crucial milestone comes as company ramps to panther lake chips,POSITIVE,0.5115513205528259,security,0.5527588725090027,3
Wed Apr  2 21:44:52 2025,Brain waves become spoken words in AI breakthrough for paralysis,999.0,brain waves become spoken words in ai breakthrough for paralysis,NEUTRAL,0.790837824344635,AI,0.967862904071808,3
Wed Apr  2 21:44:57 2025,"One of Australia’s oldest wind farms turns 20 today, and will live on for another decade",999.0,one of australias oldest wind farms turns 20 today and will live on for another decade,POSITIVE,0.6939939260482788,security,0.3538978695869446,1
Wed Apr  2 21:45:02 2025,"""Tech’s big anxiety: fewer jobs, lower pay, more AI""",999.0,techs big anxiety fewer jobs lower pay more ai,NEGATIVE,0.6882169246673584,AI,0.3727178573608398,2
Wed Apr  2 21:45:07 2025,"""Crosspost: I’m a former CIA officer, National Security Council staffer, and diplomat – AMA about Signalgate""",999.0,crosspost im a former cia officer national security council staffer and diplomat  ama about signalgate,NEUTRAL,0.8575809597969055,security,0.9127793908119202,2
Wed Apr  2 21:45:12 2025,Former Sony Exec Says It's About Time For PlayStation to Reconsider Its Focus on Cutting-Edge Graphics,999.0,former sony exec says its about time for playstation to reconsider its focus on cuttingedge graphics,NEUTRAL,0.78330397605896,hardware,0.4076648950576782,3
Wed Apr  2 21:45:17 2025,"ZeniMax workers union votes to authorize a strike against Microsoft over stalled contract negotiations | After nearly two years of negotiations, a contract agreement still hasn't been reached.",999.0,zenimax workers union votes to authorize a strike against microsoft over stalled contract negotiations  after nearly two years of negotiations a contract agreement still hasnt been reached.,NEGATIVE,0.6530479192733765,software,0.6770579218864441,4
Wed Apr  2 21:45:22 2025,Nikola founder says nearly $2 million in political donations he and his wife gave to President Donald Trump had nothing to do with his pardon,999.0,nikola founder says nearly $2 million in political donations he and his wife gave to president donald trump had nothing to do with his pardon,NEUTRAL,0.7188839316368103,software,0.5521555542945862,1
Wed Apr  2 21:45:27 2025,Japan's Rapidus gears up for test production of next-generation chips,999.0,japans rapidus gears up for test production of nextgeneration chips,NEUTRAL,0.9056629538536072,hardware,0.6512426733970642,1
Wed Apr  2 21:45:32 2025,Nintendo has moved beyond specs | The company is as popular as it has ever been — and it owes it to leaving the technological arms race behind,999.0,nintendo has moved beyond specs  the company is as popular as it has ever been  and it owes it to leaving the technological arms race behind,POSITIVE,0.892217755317688,security,0.2531197369098663,1
Wed Apr  2 21:45:37 2025,Trump Sets Up New Office To Manage CHIPS Act And Speed Up Investments,999.0,trump sets up new office to manage chips act and speed up investments,NEUTRAL,0.8475819230079651,gadgets,0.4456136524677276,1
Wed Apr  2 21:45:42 2025,Police told not to close investigations until they have used facial recognition,999.0,police told not to close investigations until they have used facial recognition,NEUTRAL,0.6199040412902832,security,0.6895129084587097,3
Wed Apr  2 21:45:47 2025,Lightmatter says it's ready to ship chip-to-chip optical highways as early as summer,999.0,lightmatter says its ready to ship chiptochip optical highways as early as summer,NEUTRAL,0.8559088706970215,hardware,0.3170660138130188,3
Wed Apr  2 21:45:52 2025,SpaceX Shares Stunning Polar Views From Its Historic Fram2 Mission,999.0,spacex shares stunning polar views from its historic fram2 mission,POSITIVE,0.9157482385635376,hardware,0.6034005880355835,3
